commit	val_loss	text_bpb	audio_loss	memory_gb	status	description
236cf2f	3.536923	1.093229	5.573935	16.3	keep	sched: cosine+WD0.03
3ade95f	3.556669	1.096869	5.635018	16.3	keep	sched: cosine+warmup0.05
a43b6d0	3.527002	1.090431	5.555050	16.3	keep	sched: WD0.03+warmup0.05
650e777	3.514229	1.085413	5.547421	16.3	keep	lr: 0.03
6173602	3.512348	1.084546	5.548219	16.3	keep	lr: 0.035
1419108	3.506125	1.082643	5.537822	16.3	keep	lr: 0.045
677504d	3.515466	1.087332	5.530849	16.3	keep	lr: 0.05
bf5883a	3.512792	1.083161	5.567544	16.3	keep	lr: 0.055
5048e75	3.477908	1.072174	5.515434	16.3	keep	lr0.04+batch64K
0ae6533	3.492678	1.078962	5.511642	16.3	keep	lr0.05+batch64K
68a5bb2	3.488319	1.076470	5.518605	16.3	keep	lr0.035+batch64K
72e1ad5	3.512190	1.082316	5.574557	16.3	keep	lr0.04+WD0.03
ff78896	3.495726	1.078833	5.529383	16.3	keep	batch64K+WD0.03
3957565	3.492048	1.075206	5.553794	16.3	keep	final: reference
9d08138	3.481180	1.074609	5.503407	16.3	keep	final: WD0.03
32da28b	3.489989	1.077629	5.513540	16.3	keep	final: WD0.07
d0dff6a	3.476378	1.069588	5.538681	16.3	keep	final: warmdown0.8
e196aff	3.487730	1.076386	5.516669	16.3	keep	final: warmdown0.7
a6f7e79	3.498071	1.080552	5.521142	16.3	keep	final: mom0.98
4150cb9	3.490812	1.078471	5.507586	16.3	keep	final: mom0.96
ea84571	3.467673	1.068555	5.504545	16.3	keep	final: LR0.03
14169e3	3.498354	1.081107	5.515684	16.3	keep	final: LR0.05
760799f	0	0	0	16.3	crash	final: batch32K
46f8960	0	0	0	16.3	crash	final: LR0.03+batch32K
6932fce	3.378260	1.035814	5.426126	16.3	keep	final: 10min
643213e	3.471841	1.069498	5.515472	16.3	keep	comb: reference
f82f6fc	3.478575	1.073223	5.506025	16.3	keep	comb: warmdown0.8
ab63f41	3.470450	1.067520	5.532283	16.3	keep	comb: WD0.03
4d197c0	3.484046	1.074757	5.516611	16.3	keep	comb: wd0.8+WD0.03
17614b5	3.481092	1.073856	5.511722	16.3	keep	comb: warmdown0.85
6a26d9c	3.479114	1.069608	5.552801	16.3	keep	comb: WD0.02
7afe8ee	3.466123	1.065613	5.532206	16.3	keep	comb: LR0.025
c04409f	3.475781	1.071195	5.515892	16.3	keep	comb: LR0.02
255cbaa	3.362642	1.029681	5.417135	16.3	keep	comb: best_10min
78b5922	3.414960	1.052904	5.414315	16.3	keep	comb: baseline_10min
eede4f7	3.476045	1.071794	5.509813	16.3	keep	paper: best_5min_s42
1b9f917	3.480648	1.073154	5.517902	16.3	keep	paper: best_5min_s137
176e661	3.478235	1.071884	5.520575	16.3	keep	paper: best_5min_s2024
47b5284	3.545888	1.097579	5.568522	16.3	keep	paper: baseline_5min_s42
4c005f0	3.538120	1.095977	5.546833	16.3	keep	paper: baseline_5min_s137
a391281	3.547494	1.097554	5.577388	16.3	keep	paper: baseline_5min_s2024
5c19672	0	0	0	16.3	crash	paper: best_10min_conv
ffe7dfa	3.405283	1.049870	5.398770	16.3	keep	paper: baseline_10min_conv
13cebc6	3.367959	1.027758	5.468935	16.3	keep	paper: best_10min_conv
88bbefa	3.298953	1.000188	5.435978	16.3	keep	paper: best_20min_conv
7e25baf	3.334075	1.017993	5.407047	16.3	keep	paper: baseline_20min_conv
cb9d66a	3.374353	1.033020	5.439339	16.3	keep	abl10: full_best
6747376	3.372689	1.036012	5.393865	16.3	keep	abl10: -coupledWD
4fa96e9	3.387088	1.040243	5.419646	16.3	keep	abl10: -lowerWD
125bbe5	3.360565	1.030353	5.397802	16.3	keep	abl10: -mom97
f4c3602	3.407720	1.047416	5.441979	16.3	keep	abl10: -batch64K
150cf1b	3.410188	1.048279	5.444888	16.3	keep	abl10: -lowerLR
aebfe4f	3.405656	1.049446	5.406235	16.3	keep	abl10: full_baseline
b46bf96	3.725978	1.162270	5.742093	16.3	keep	scale: best_d4
1e37a38	3.729323	1.161897	5.764620	16.3	keep	scale: baseline_d4
11d012f	3.481695	1.074718	5.504858	16.3	keep	scale: best_d8
4c29c6e	3.542225	1.097235	5.553333	16.3	keep	scale: baseline_d8
4d52675	3.598602	1.100588	5.813385	16.3	keep	scale: best_d12
1e5d1c3	3.754305	1.155239	5.979116	16.3	keep	scale: baseline_d12
d04d10b	3.764786	1.158643	5.993898	16.3	keep	scale: best_d16
0a7b38f	3.787581	1.168023	6.000951	16.3	keep	scale: baseline_d16
1a7a6f1	3.394563	1.041188	5.447905	16.3	keep	scaledur: d12_best_10min
8f0c24e	3.501725	1.080681	5.538810	16.3	keep	scaledur: d12_baseline_10min
8124ee5	3.478353	1.072527	5.513203	16.3	keep	scaledur: d8_mom95_5min
1fc8482	3.358060	1.026651	5.429922	16.3	keep	scaledur: d8_mom95_10min
5a3c0c7	3.479927	1.072396	5.523505	16.3	keep	recipe: ref_5min
1b35f61	3.476542	1.071162	5.520391	16.3	keep	recipe: mom96_5min
c9fd09f	3.471553	1.069933	5.508597	16.3	keep	recipe: mom95_5min
b38b0a4	3.357317	1.027594	5.414021	16.3	keep	recipe: mom96_10min
401c77c	3.475301	1.071509	5.509558	16.3	keep	recipe: mom95_wd03_5min
9d48696	3.359038	1.028372	5.413798	16.3	keep	recipe: mom95_wd03_10min
e93d45a	3.463148	1.064638	5.528382	16.3	keep	final: best_5min_s42
3aa4256	3.468118	1.068496	5.507662	16.3	keep	final: best_5min_s137
010dc72	3.469869	1.069831	5.501000	16.3	keep	final: best_5min_s2024
be7644f	3.545208	1.097432	5.566854	16.3	keep	final: baseline_5min_s42
8e70fa0	3.544390	1.096099	5.578893	16.3	keep	final: baseline_5min_s137
3acb549	3.545762	1.098674	5.554476	16.3	keep	final: baseline_5min_s2024
5c45271	3.364911	1.031041	5.412730	16.3	keep	final: best_10min_s42
547905b	3.362991	1.030657	5.407194	16.3	keep	final: best_10min_s137
9c4e094	3.358855	1.029506	5.399268	16.3	keep	final: best_10min_s2024
04a14a2	3.470354	1.068618	5.518145	16.3	keep	ns_b2: ref
ac511ec	3.467109	1.069842	5.486164	16.3	keep	ns_b2: ns5
c7565ce	3.476517	1.071822	5.512049	16.3	keep	ns_b2: ns15
c891bc2	3.476072	1.069773	5.534734	16.3	keep	ns_b2: ns20
f868ed7	3.473058	1.071159	5.501635	16.3	keep	ns_b2: beta2_0.99
f72a4b5	3.464533	1.067685	5.498799	16.3	keep	ns_b2: beta2_0.90
08034d7	3.474651	1.070546	5.517721	16.3	keep	ns_b2: beta2_0.999
3c1309d	3.473144	1.069795	5.518847	16.3	keep	ns_b2: warmdown0.8
f3af744	3.469920	1.070141	5.497662	16.3	keep	ns_b2: warmdown0.65
7cefdea	3.469329	1.070003	5.495844	16.3	keep	comb2: ns5+b90_5min
f3d9108	3.469820	1.069793	5.501377	16.3	keep	comb2: ns5_5min
59f3ea8	3.472956	1.068624	5.532125	16.3	keep	comb2: b90_5min
b03de11	3.366970	1.031200	5.422089	16.3	keep	comb2: ns5+b90_10min
eb207bd	3.356510	1.028788	5.395304	16.3	keep	comb2: ref_10min
a9bb39c	3.536260	1.091461	5.591856	16.3	keep	omni36: ref
b6cc714	0	0	0	16.3	crash	omni36: craw_a0.1
a850865	3.554450	1.095788	5.636466	16.3	keep	omni36: ref
ea72149	0	0	0	16.3	crash	omni36: craw_a0.1
23b3a55	0	0	0	16.3	crash	omni36: craw_a0.3
b27579a	3.459625	1.064183	5.515320	16.3	keep	omni36: ref
8ae94f9	3.480362	1.072184	5.528368	16.3	keep	omni36: craw_a0.1
bb40302	3.474244	1.068659	5.538375	16.3	keep	omni36: craw_a0.3
61df543	3.477284	1.068561	5.555905	16.3	keep	omni36: craw_a0.5
db3c7ca	3.501881	1.079360	5.555714	16.3	keep	omni36: gim_t0.0
01384bd	3.474995	1.071807	5.504118	16.3	keep	dual37: ref
f1b71a9	3.486580	1.080024	5.465900	16.3	keep	dual37: alt_5
ab56745	3.505325	1.099248	5.332020	16.3	keep	dual37: alt_3
9970162	3.551460	1.087926	5.715964	16.3	keep	dual37: alt5+dualmom
2e98757	3.731803	1.149802	5.925179	16.3	keep	dual37: alt3+dualmom
a71e625	3.487500	1.072779	5.558909	16.3	keep	dual37: alt5+audiomom0.98
06e9acb	3.480718	1.079446	5.441784	16.3	keep	dual37: alt5+audiolr1.5
21e4e75	0	0	0	16.3	crash	dual37: alt5+mom98+lr1.5
313d6ee	3.618472	1.115481	5.738009	16.3	keep	dual37: dualmom+mom98+lr1.5
e8b9ed0	3.706407	1.175734	5.474527	16.3	keep	dual37: alt2+dualmom
96804bc	3.512664	1.077085	5.640635	16.3	keep	dual37: alt5+audiomom0.99
182358e	3.628726	1.079871	5.428667	16.3	keep	dual37: mixed_ratio0.3
59853ba	4.208359	1.121520	5.272272	16.3	keep	dual37: mixed_ratio0.5
3bca2d9	3.793980	1.227741	5.309021	16.3	keep	dual37: alt2+dualmom+mom98+lr1.5
62ae329	3.469636	1.070463	5.492074	16.3	keep	adv38: ref
5696050	0	0	0	16.3	crash	adv38: a3_snr
fb7fae6	0	0	0	16.3	crash	adv38: a4_proj_1.5
f2d9530	0	0	0	16.3	crash	adv38: a4_proj_2.0
45d9b76	0	0	0	16.3	crash	adv38: a4_proj_3.0
5fc6dc8	0	0	0	16.3	crash	adv38: a5_curv
a46b6d5	0	0	0	16.3	crash	adv38: a6_ortho_1.5
7dc1820	0	0	0	16.3	crash	adv38: a6_ortho_2.0
3971c63	0	0	0	16.3	crash	adv38: a8_damp_0.3
4bbfb7a	0	0	0	16.3	crash	adv38: a8_damp_0.5
5a2bc84	0	0	0	16.3	crash	adv38: a4_2.0+a8_0.5
31f76df	0	0	0	16.3	crash	adv38: a3+a6_1.5
62ae329	3.473900	1.072510	5.489993	16.3	keep	adv38: ref
5696050	3.481799	1.073700	5.517336	16.3	keep	adv38: a3_snr
fb7fae6	3.490990	1.074386	5.558162	16.3	keep	adv38: a4_proj_1.5
f2d9530	3.540597	1.090432	5.627511	16.3	keep	adv38: a4_proj_2.0
45d9b76	4.343769	1.378422	6.409183	16.3	keep	adv38: a4_proj_3.0
5fc6dc8	3.491307	1.075783	5.542671	16.3	keep	adv38: a5_curv
a46b6d5	3.481779	1.073135	5.524583	16.3	keep	adv38: a6_ortho_1.5
7dc1820	3.479928	1.072707	5.519490	16.3	keep	adv38: a6_ortho_2.0
3971c63	3.488435	1.075501	5.530563	16.3	keep	adv38: a8_damp_0.3
4bbfb7a	3.485950	1.076958	5.499700	16.3	keep	adv38: a8_damp_0.5
5a2bc84	3.606346	1.110643	5.732387	16.3	keep	adv38: a4_2.0+a8_0.5
31f76df	3.502741	1.080467	5.546891	16.3	keep	adv38: a3+a6_1.5
ce0e33e	3.476023	1.071553	5.513051	16.3	keep	post39: ref
3eb9830	3.481805	1.079235	5.449988	16.3	keep	post39: alt5+lr2.0
4e61a2f	3.485621	1.078692	5.476937	16.3	keep	post39: alt5+lr2.5
263666a	3.491154	1.082312	5.462316	16.3	keep	post39: alt5+lr3.0
3662b07	3.555483	1.099772	5.593269	16.3	keep	post39: alt5+mom0.8+lr1.5
a9124ee	3.521298	1.090801	5.520133	16.3	keep	post39: alt5+mom0.85+lr1.5
a6c6da2	3.501477	1.085986	5.472992	16.3	keep	post39: alt5+mom0.9+lr2.0
47927e4	3.486158	1.077317	5.496823	16.3	keep	post39: alt5+lr1.5+wd0.5
addbef2	3.485785	1.077913	5.487327	16.3	keep	post39: alt5+lr2.0+wd0.0
2ea8cee	3.516401	1.100919	5.371064	16.3	keep	post39: alt3+lr1.5
375537b	3.513024	1.100001	5.363896	16.3	keep	post39: alt3+lr2.0
cb346ee	3.529946	1.092759	5.542242	16.3	keep	post39: alt5+mom0.85+lr2.0+wd0.5
73cffb3	3.498665	1.088568	5.426648	16.3	keep	post39: cosine_audio
34c9dad	3.474255	1.070403	5.517394	16.3	keep	orth40: ref
a130f44	3.479336	1.079243	5.436703	16.3	keep	orth40: proj0.5
8e89310	3.484832	1.080221	5.454309	16.3	keep	orth40: proj1.0
7c335d4	3.481858	1.079159	5.451207	16.3	keep	orth40: proj0.75
bcef797	3.483815	1.078708	5.467058	16.3	keep	orth40: proj0.5+lr1.5
e393b89	3.487114	1.080940	5.457827	16.3	keep	orth40: proj1.0+lr1.5
8c70c89	3.491144	1.080560	5.483564	16.3	keep	orth40: freeze_bot2
49cb8df	3.504653	1.087180	5.475452	16.3	keep	orth40: freeze_bot4
753399d	3.491181	1.082462	5.460654	16.3	keep	orth40: freeze_top2
b7d295d	3.503027	1.086224	5.478139	16.3	keep	orth40: sens1.5
3704883	3.497783	1.085860	5.454696	16.3	keep	orth40: proj0.5+freeze_bot2+lr1.5
